### ISSUE TITLE
[Help] How to use this?

### ISSUE THREAD

**Issue by ge9** [kazuho/rat#4]
Hi,
I'm quite new to linux tun/tap system, and I haven't yet make rat work in my Linux Mint 21.2.
The Linux has a physical interface (enp1s0) and already has 192.168.1.12/24.
Basically, I did the following:
- change the hard-coded `global_addr` from 192.168.0.139 to 192.168.1.139 
- add 192.168.1.139 to enp1s0 by `ip addr add 192.168.1.139/24 dev enp1s0`
- `sudo ruby rat.rb`
- `ip addr add 192.168.2.2/32 dev rat`
- `ip link set rat up`
- add `230 rat` to /etc/iproute2/rt_tables
- `ip route add default dev rat table rat`
- `ip rule add from 192.168.2.2 lookup rat`
- set net.ipv4.ip_forward to 1
- set net.ipv4.conf.*.accept_local to 1
- set net.ipv4.conf.*.rp_filter to 2
- no firewall (ufw disabled)

Then, packets from 192.168.2.2 are correctly NATted to 192.168.1.139 and go out from enp1s0. However, the reply packets comming from outside seem not passed to rat. For example, when a UDP packet is returned to 192.168.1.139:9000 (since it is NATted by rat, it has port range 9000-9999), the Linux sends "UDP port unreachable" to the remote host, like its normal behavior observed when there is no application listening 192.168.1.139.

The following is some result of `tcpdump`.
1. `sudo tcpdump -n -i any host 8.8.8.8` with `ping -I 192.168.2.2 8.8.8.8` (or equivalently, `ping -I rat 8.8.8.8`)

```
12:04:21.088490 rat   Out IP 192.168.2.2 > 8.8.8.8: ICMP echo request, id 210, seq 1, length 64
12:04:21.089233 rat   In  IP 192.168.1.139 > 8.8.8.8: ICMP echo request, id 9870, seq 1, length 64
12:04:21.089274 enp1s0 Out IP 192.168.1.139 > 8.8.8.8: ICMP echo request, id 9870, seq 1, length 64
12:04:21.096771 enp1s0 In  IP 8.8.8.8 > 192.168.1.139: ICMP echo reply, id 9870, seq 1, length 64
12:04:22.099260 rat   Out IP 192.168.2.2 > 8.8.8.8: ICMP echo request, id 210, seq 2, length 64
12:04:22.099554 rat   In  IP 192.168.1.139 > 8.8.8.8: ICMP echo request, id 9870, seq 2, length 64
12:04:22.099613 enp1s0 Out IP 192.168.1.139 > 8.8.8.8: ICMP echo request, id 9870, seq 2, length 64
12:04:22.106525 enp1s0 In  IP 8.8.8.8 > 192.168.1.139: ICMP echo reply, id 9870, seq 2, length 64
```

3.  `sudo tcpdump -n -i any host 3.132.228.249` with `./stunclient --protocol udp --verbosity 50 --mode basic --localaddr rat 
 
```
stunserver.stunprotocol.org` (`3.132.228.249` is the address for `stunserver.stunprotocol.org`)
12:06:44.148282 rat   Out IP 192.168.2.2.37889 > 3.132.228.249.3478: UDP, length 28
12:06:44.148791 rat   In  IP 192.168.1.139.9001 > 3.132.228.249.3478: UDP, length 28
12:06:44.148830 enp1s0 Out IP 192.168.1.139.9001 > 3.132.228.249.3478: UDP, length 28
12:06:44.320813 enp1s0 In  IP 3.132.228.249.3478 > 192.168.1.139.9001: UDP, length 68
12:06:44.320896 enp1s0 Out IP 192.168.1.139 > 3.132.228.249: ICMP 192.168.1.139 udp port 9001 unreachable, length 104
12:06:47.151221 rat   Out IP 192.168.2.2.37889 > 3.132.228.249.3478: UDP, length 28
12:06:47.151455 rat   In  IP 192.168.1.139.9001 > 3.132.228.249.3478: UDP, length 28
12:06:47.151498 enp1s0 Out IP 192.168.1.139.9001 > 3.132.228.249.3478: UDP, length 28
12:06:47.325132 enp1s0 In  IP 3.132.228.249.3478 > 192.168.1.139.9001: UDP, length 68
12:06:47.325242 enp1s0 Out IP 192.168.1.139 > 3.132.228.249: ICMP 192.168.1.139 udp port 9001 unreachable, length 104
```

7. `sudo tcpdump -n -i any host 142.251.42.142` with `curl --interface rat https://google.com` (`142.251.42.142` is the ip address for `google.com`)
```
12:09:28.434391 rat   Out IP 192.168.2.2.49494 > 142.251.42.142.443: Flags [S], seq 708483564, win 64240, options [mss 1460,sackOK,TS val 3772813553 ecr 0,nop,wscale 7], length 0
12:09:28.434771 rat   In  IP 192.168.1.139.9574 > 142.251.42.142.443: Flags [S], seq 708483564, win 64240, options [mss 1460,sackOK,TS val 3772813553 ecr 0,nop,wscale 7], length 0
12:09:28.434810 enp1s0 Out IP 192.168.1.139.9574 > 142.251.42.142.443: Flags [S], seq 708483564, win 64240, options [mss 1460,sackOK,TS val 3772813553 ecr 0,nop,wscale 7], length 0
12:09:28.442890 enp1s0 In  IP 142.251.42.142.443 > 192.168.1.139.9574: Flags [S.], seq 356525067, ack 708483565, win 65535, options [mss 1412,sackOK,TS val 2207212650 ecr 3772813553,nop,wscale 8], length 0
12:09:28.442942 enp1s0 Out IP 192.168.1.139.9574 > 142.251.42.142.443: Flags [R], seq 708483565, win 0, length 0
12:09:29.459207 rat   Out IP 192.168.2.2.49494 > 142.251.42.142.443: Flags [S], seq 708483564, win 64240, options [mss 1460,sackOK,TS val 3772814578 ecr 0,nop,wscale 7], length 0
12:09:29.459473 rat   In  IP 192.168.1.139.9574 > 142.251.42.142.443: Flags [S], seq 708483564, win 64240, options [mss 1460,sackOK,TS val 3772814578 ecr 0,nop,wscale 7], length 0
12:09:29.459554 enp1s0 Out IP 192.168.1.139.9574 > 142.251.42.142.443: Flags [S], seq 708483564, win 64240, options [mss 1460,sackOK,TS val 3772814578 ecr 0,nop,wscale 7], length 0
12:09:29.467456 enp1s0 In  IP 142.251.42.142.443 > 192.168.1.139.9574: Flags [S.], seq 372541561, ack 708483565, win 65535, options [mss 1412,sackOK,TS val 2207213675 ecr 3772814578,nop,wscale 8], length 0
12:09:29.467511 enp1s0 Out IP 192.168.1.139.9574 > 142.251.42.142.443: Flags [R], seq 708483565, win 0, length 0
```

How should I set up rat correctly? Any helps will be appreciated. Thank you.

**Comment by ge9** [comment]
Now I figured it out.
Not only outbound packets but also inbound packets should be routed to the interface "rat" by the route table, so the `global_addr` shouldn't be an address assigned to the Linux.
I did the following:
- revert the `global_addr` change (192.168.1.139 -> 192.168.0.139)
- (192.168.1.139/24 is still assigned to enp1s0)
- SNAT&DNAT between 192.168.0.139 <-> 192.168.139
  - sudo iptables -t nat -A POSTROUTING -o enp1s0 -s 192.168.0.139 -j SNAT --to-source 192.168.1.139
  - sudo iptables -t nat -A PREROUTING -i enp1s0 -d 192.168.1.139 -j DNAT --to-destination 192.168.0.139
- `ip rule add to 192.168.0.139 lookup rat`

When Linux received inbound packets at 192.168.1.139, it is DNATted to 192.168.0.139, and since the Linux don't have 192.168.0.139, it checks the route table and then ask rat to process the packets.
